<?xml version="1.0" encoding="UTF-8" standalone="no"?>
<database xmlns:xsi="http://www.w3.org/2001/XMLSchema-instance" xsi:noNamespaceSchemaLocation="libraryDatabase.xsd">
    <users>
        <user>
            <username>bela</username>
            <password>
                <hashedPassword>$2a$04$uXb8rTLKZFpEB4NIgb7pa.EcfYMDrF/srpoKzmKofDCNJsTIi5/ri</hashedPassword>
            </password>
            <name>
                <firstname>Bela</firstname>
                <lastname>Toth</lastname>
            </name>
            <email>bela.toth@example.com</email>
            <mobileNumber>06201234567</mobileNumber>
            <role>LIBRARIAN</role>
        </user>
        <user>
            <username>feri</username>
            <password>
                <hashedPassword>$2a$04$uXb8rTLKZFpEB4NIgb7pa.EcfYMDrF/srpoKzmKofDCNJsTIi5/ri</hashedPassword>
            </password>
            <name>
                <firstname>Ferenc</firstname>
                <lastname>Kovacs</lastname>
            </name>
            <email>kovfer@example.com</email>
            <mobileNumber>0680123456</mobileNumber>
            <role>READER</role>
        </user>
    </users>
    
    <books>
        <book>
            <ISBN>123456</ISBN>
            <author>Pasztor Lajos</author>
            <title>Utazas a Fold korul</title>
            <publishDate>2010</publishDate>
            <genre>Travel</genre>
        </book>
        <book>
            <ISBN>1234567</ISBN>
            <author>Nagy Kalman</author>
            <title>Analizis III.</title>
            <publishDate>2013</publishDate>
            <genre>Scifi</genre>
        </book>
    </books>
    
    <bookInstances>
        <bookInstance>
            <inventoryNumber>123456789</inventoryNumber>
            <bookISBN>123456</bookISBN>
            <isLoaned>false</isLoaned>
        </bookInstance>
        <bookInstance>
            <inventoryNumber>123456790</inventoryNumber>
            <bookISBN>123456</bookISBN>
            <isLoaned>true</isLoaned>
        </bookInstance>
        <bookInstance>
            <inventoryNumber>123456791</inventoryNumber>
            <bookISBN>1234567</bookISBN>
            <isLoaned>false</isLoaned>
        </bookInstance>
    </bookInstances>
    
    <borrowings>
        <borrowing>
            <borrowID>1234567</borrowID>
            <readerUsername>feri</readerUsername>
            <creationDate>2017-01-10</creationDate>
            <expirationDate>2017-02-26</expirationDate>
            <status>EXPIRED</status>
            <bookInstanceInventoryNumber>123456790</bookInstanceInventoryNumber>
        </borrowing>
        <borrowing>
            <borrowID>12345678</borrowID>
            <readerUsername>feri</readerUsername>
            <creationDate>2018-11-06</creationDate>
            <expirationDate>2019-01-01</expirationDate>
            <status>BORROWED</status>
            <bookInstanceInventoryNumber>123456790</bookInstanceInventoryNumber>
        </borrowing>
        <borrowing>
            <borrowID>2222345678</borrowID>
            <readerUsername>feri</readerUsername>
            <creationDate>2018-11-06</creationDate>
            <expirationDate>2019-01-01</expirationDate>
            <status>REQUESTED</status>
            <bookInstanceInventoryNumber>123456791</bookInstanceInventoryNumber>
        </borrowing>
    </borrowings>


</database>